"r_id","r_nom","r_desc","r_url"
"1","Boutiques Paysannes","Elle pr&ocirc;ne la vente directe et sans interm&eacute;diaire de produits fermiers issus des exploitations des producteurs.<br><br>Elle offre la garantie de l'origine des produits et la transparence sur les modes d'&eacute;levage, de culture et de transformation.<br><br>","https://www.boutiquespaysannes.fr"
"2","Terre d'envies","Les 34 magasins de producteurs du r&eacute;seau Terre d&#146;envies s&#146;engagent sur une id&eacute;e simple : <br>Vendre des produits fermiers de saison, sains et de qualit&eacute;.<br>Garantir l&#146;&eacute;change et le dialogue avec la pr&eacute;sence d&#146;un producteur &agrave; la vente.<br>Promouvoir une agriculture responsable en circuit court et &agrave; dimension humaine.<br>Leur devise :&laquo; Produits de nos fermes, vendus par nous-m&ecirc;mes &raquo;.","http://www.terredenvies.fr"
"3","Bienvenue &agrave; la Ferme","En adh&eacute;rant au r&eacute;seau, les agriculteurs s&#146;engagent &agrave; respecter les chartes de qualit&eacute; Bienvenue &agrave; la Ferme et vous garantissent ainsi la qualit&eacute; de leurs prestations touristiques et agricoles.","http://www.bienvenue-a-la-ferme.com/"
"4","Idoki",,
"5","r&eacute;seau test",,
"6","Magasins de Producteurs de PACA","Les magasins de ce r&eacute;seau remplissent les conditions suivantes :<br><br>Une gestion par un collectif de producteurs.<br>La transparence sur l&#146;origine des produits.<br>La vente uniquement de produits issus des exploitations de la r&eacute;gion Paca et d&eacute;partements limitrophes.<br>Une participation active de chaque producteur au magasin.",
